{
  "$schema": "https://json-schema.org/draft/2020-12/schema",
  "$id": "https://gttome.github.io/Daily-AI-Brief-Compiler/contracts/compiler-state.schema.json",
  "title": "Daily Compiler State v1",
  "type": "object",
  "additionalProperties": false,
  "required": [
    "schema_version",
    "edition_date",
    "execution_id",
    "branch",
    "state",
    "stage",
    "started_at",
    "updated_at",
    "editorial_bundle",
    "images",
    "bundle",
    "last_error",
    "retryable"
  ],
  "properties": {
    "schema_version": {
      "const": "daily-compiler-state-v1"
    },
    "edition_date": {
      "type": "string",
      "pattern": "^\\d{4}-\\d{2}-\\d{2}$"
    },
    "execution_id": {
      "type": "string",
      "minLength": 1
    },
    "branch": {
      "type": "string",
      "pattern": "^shadow/\\d{4}-\\d{2}-\\d{2}$"
    },
    "engine_sha": {
      "type": "string",
      "pattern": "^[a-f0-9]{40}$",
      "description": "Exact qualified protected release engine, set at allocation and immutable through resume, sealing and finalization. Required for new operational editions; exact registered terminal history is preserved without retrofit."
    },
    "state": {
      "enum": [
        "ALLOCATED",
        "PRODUCING",
        "BUNDLE_READY",
        "COMPILING",
        "PREVIEW_READY",
        "SHADOW_VERIFIED",
        "SHADOW_FAILED"
      ]
    },
    "stage": {
      "enum": [
        "EDITORIAL",
        "CONTENT",
        "IMAGES",
        "BUNDLE",
        "COMPILE",
        "VERIFY"
      ]
    },
    "started_at": {
      "type": "string",
      "format": "date-time"
    },
    "updated_at": {
      "type": "string",
      "format": "date-time"
    },
    "editorial_bundle": {
      "type": "object",
      "additionalProperties": false,
      "required": [
        "status",
        "digest"
      ],
      "properties": {
        "status": {
          "enum": [
            "pending",
            "complete"
          ]
        },
        "digest": {
          "type": [
            "string",
            "null"
          ]
        }
      }
    },
    "images": {
      "type": "object",
      "additionalProperties": false,
      "required": [
        "required",
        "accepted"
      ],
      "properties": {
        "required": {
          "const": 6
        },
        "accepted": {
          "type": "array",
          "maxItems": 6,
          "uniqueItems": true,
          "items": {
            "type": "string"
          }
        },
        "strategy": {
          "enum": [
            "proposal1r_legacy",
            "d0_native_image_capsules",
            "d1_cloud_image_studio",
            "d1_work_browser_fresh_chat"
          ]
        },
        "phase": {
          "enum": [
            "PLANNED",
            "IN_PROGRESS",
            "SET_REVIEW_READY",
            "SET_PASS",
            "ACCEPTED",
            "STUDIO_RUNNING",
            "PACKAGE_ACCEPTED",
            "WORK_INGEST",
            "GITHUB_VERIFIED",
            "SPEC_READY",
            "STUDIO_REQUESTED",
            "BROWSER_RUNNING",
            "GIT_INGEST"
          ]
        },
        "set_plan_path": {
          "type": [
            "string",
            "null"
          ]
        },
        "set_plan_sha256": {
          "type": [
            "string",
            "null"
          ]
        },
        "set_review_path": {
          "type": [
            "string",
            "null"
          ]
        },
        "set_review_sha256": {
          "type": [
            "string",
            "null"
          ]
        },
        "acceptance_path": {
          "type": [
            "string",
            "null"
          ]
        },
        "acceptance_sha256": {
          "type": [
            "string",
            "null"
          ]
        },
        "acceptance_manifest_path": {
          "type": [
            "string",
            "null"
          ]
        },
        "acceptance_manifest_sha256": {
          "type": [
            "string",
            "null"
          ]
        },
        "work_porter_receipt_path": {
          "type": [
            "string",
            "null"
          ]
        },
        "work_porter_receipt_sha256": {
          "type": [
            "string",
            "null"
          ]
        },
        "ingest_handoff_path": {
          "type": [
            "string",
            "null"
          ]
        },
        "ingest_handoff_sha256": {
          "type": [
            "string",
            "null"
          ]
        },
        "strategy_bound_at": {
          "type": [
            "string",
            "null"
          ],
          "format": "date-time"
        },
        "strategy_contract_version": {
          "type": [
            "string",
            "null"
          ]
        }
      }
    },
    "bundle": {
      "type": "object",
      "additionalProperties": false,
      "required": [
        "status",
        "digest"
      ],
      "properties": {
        "status": {
          "enum": [
            "pending",
            "BUNDLE_READY"
          ]
        },
        "digest": {
          "type": [
            "string",
            "null"
          ]
        }
      }
    },
    "last_error": {
      "type": [
        "object",
        "string",
        "null"
      ]
    },
    "retryable": {
      "type": "boolean"
    },
    "preview": {
      "type": "object"
    },
    "reader_parity": {
      "type": "object"
    },
    "observability": {
      "type": "object",
      "additionalProperties": false,
      "properties": {
        "events_path": {
          "type": [
            "string",
            "null"
          ]
        },
        "metrics_path": {
          "type": [
            "string",
            "null"
          ]
        },
        "analysis_path": {
          "type": [
            "string",
            "null"
          ]
        },
        "dashboard_snapshot_path": {
          "type": [
            "string",
            "null"
          ]
        }
      }
    },
    "learning": {
      "type": "object",
      "additionalProperties": false,
      "properties": {
        "problems_dir": {
          "type": [
            "string",
            "null"
          ]
        },
        "ledger_path": {
          "type": [
            "string",
            "null"
          ]
        }
      }
    },
    "corrections": {
      "type": "object",
      "additionalProperties": false,
      "required": [
        "active_correction_id",
        "revision",
        "type",
        "status"
      ],
      "properties": {
        "active_correction_id": {
          "type": "string"
        },
        "revision": {
          "type": "integer",
          "minimum": 1
        },
        "type": {
          "type": "string"
        },
        "status": {
          "enum": [
            "VALIDATED",
            "PR_OPEN",
            "MERGED",
            "DEPLOYED",
            "VERIFIED",
            "BLOCKED"
          ]
        }
      }
    },
    "research_cutoff_at": {
      "type": "string",
      "format": "date-time",
      "description": "Set once during EDITORIAL for current media qualification; immutable through resume and sealing. Absent in preserved historical states."
    }
  }
}
