{
  "schema_version": "daily-compiler-state-v1",
  "edition_date": "2026-10-07",
  "execution_id": "daily-compiler-shadow-2026-10-07",
  "branch": "shadow/2026-10-07",
  "state": "BUNDLE_READY",
  "stage": "BUNDLE",
  "started_at": "2026-10-07T00:12:28Z",
  "updated_at": "2026-10-07T05:27:49.825Z",
  "editorial_bundle": {
    "status": "complete",
    "digest": "git-blob:fcf2dee34235fba83c00e1264ed4752bf4553e2d"
  },
  "images": {
    "required": 6,
    "accepted": [
      "dots-always-on-agents",
      "sagemaker-agent-skill",
      "ironclad-computer-use",
      "atlassian-openai-enterprise-context",
      "embeddinggemma2-edge-retrieval",
      "astra-ultrafast-blackwell"
    ]
  },
  "bundle": {
    "status": "BUNDLE_READY",
    "digest": "6ddad9c90e727f9c06065bb341ef957f4033abaa52dce8d6b933b07c57fe553a"
  },
  "last_error": null,
  "retryable": true
}
